Название продукта,Артикул,Цена товара,Адрес товараСтул дет СТУ3/9 скл мягк голуб.пласт,250107,667 руб./шт,https://vdd36.ru/catalog/mebel/mebel_detskaya/107494/,,,"Комплект детской мебели Nika КП2/9, с азбукой, от 3 до 7 лет, пенал, стул, стол",250067,1 700 руб./шт,https://vdd36.ru/catalog/mebel/mebel_detskaya/131363/"Стул детский регулируемый 18,22,26см лак",307512,1 337 руб./шт,https://vdd36.ru/catalog/mebel/mebel_detskaya/126838/Стул детский 13601,09698,518 руб./шт,https://vdd36.ru/catalog/plastmassovye_izdeliya/dlya_detey/mebel_detskaya_1/157853/Стул складной ПС+/СФ сафари,370692,526 руб./шт,https://vdd36.ru/catalog/turizm_i_otdykh/dacha_i_otdykh/stulya_skladnye/181028/"Комплект дет. мебел. Nika  КУ1/ПР ""Первоклашка""",250365,1 931 руб./шт,https://vdd36.ru/catalog/mebel/mebel_detskaya/185813/Стул складной дачный ДС/С синий,371243,453 руб./шт,https://vdd36.ru/catalog/turizm_i_otdykh/dacha_i_otdykh/stulya_skladnye/192344/Стул от компл.СТУ2/Г дет скл пластм голуб. КПУ1,254154,627 руб./шт,https://vdd36.ru/catalog/mebel/mebel_detskaya/126704/Стул походный складной ПС синий,251013,530 руб./шт,https://vdd36.ru/catalog/turizm_i_otdykh/dacha_i_otdykh/stulya_skladnye/141963/Стул походный складной ПС хаки/камуфляж,251014,530 руб./шт,https://vdd36.ru/catalog/turizm_i_otdykh/dacha_i_otdykh/stulya_skladnye/131357/Стул от компл.СТУ3/5 дет скл мяг  КУ1,250359,673 руб./шт,https://vdd36.ru/catalog/mebel/mebel_detskaya/153875/"Стул складной ""Премиум 6"" ПСП6/3 с дуб.листьями М9382",370836,3 067 руб./шт,https://vdd36.ru/catalog/turizm_i_otdykh/dacha_i_otdykh/stulya_skladnye/124470/"Стул складной ""Премиум 6"" ПСП6/ДС  джинс-синий М5067",370491,2 683 руб./шт,https://vdd36.ru/catalog/turizm_i_otdykh/dacha_i_otdykh/stulya_skladnye/133867/Стул походный складной  Премиум 1 ПСП1/4 с камнями и кленовыми листьями,371239,1 517 руб./шт,https://vdd36.ru/catalog/turizm_i_otdykh/dacha_i_otdykh/stulya_skladnye/192338/Стул походный складной детский Премиум  ПСПД/2 с красками,371242,1 594 руб./шт,https://vdd36.ru/catalog/turizm_i_otdykh/dacha_i_otdykh/stulya_skladnye/192342/Стул походный складной  ПС1/Х со спинкой хаки,371238,781 руб./шт,https://vdd36.ru/catalog/turizm_i_otdykh/dacha_i_otdykh/stulya_skladnye/192337/Стул походный складной  ПС1/С со спинкой синий,371237,781 руб./шт,https://vdd36.ru/catalog/turizm_i_otdykh/dacha_i_otdykh/stulya_skladnye/192336/Стул походный складной  ПС+/С синий,371235,526 руб./шт,https://vdd36.ru/catalog/turizm_i_otdykh/dacha_i_otdykh/stulya_skladnye/192332/Стул походный складной ПС/Ч черный,371234,520 руб./шт,https://vdd36.ru/catalog/turizm_i_otdykh/dacha_i_otdykh/stulya_skladnye/192331/Стул складной ННС/L с лимонной окантовкой,371232,510 руб./шт,https://vdd36.ru/catalog/turizm_i_otdykh/dacha_i_otdykh/stulya_skladnye/192329/